{"channel":"stable","compatibility":[{"adapterVersion":"0.1.0","channel":"stable","contentDigests":{"https://agents.md/":"eda3020070376c5cc61d15044b5bfbbd0cdf73267d1d82063bb0659df36add64"},"formatId":"agents-markdown","minEngineVersion":"0.0.0","profileId":null,"retrievedAt":"2026-08-02","rulesetVersion":"0.1.0","specificationUrls":["https://agents.md/"],"surfaceId":null,"upstreamRevision":null}],"knowledge":[{"id":"knowledge.agents-root-location","kind":"known-location","location":{"path":"AGENTS.md","scope":"repository-root"},"matcher":{"id":"location-exact","operands":{"path":"AGENTS.md","scope":"repository-root"}},"profileId":null,"ruleIds":["ACL105"],"sourceIds":["source.agents-spec"],"summary":"AGENTS.md is an instruction-file name at the repository root.","surfaceId":null}],"packId":"agent-context-bundled","packVersion":"2026.8.0","publishedAt":"2026-08-02","recordKind":"agent-context-knowledge-pack","schemaVersion":"0.1.0","sources":[{"id":"source.agents-spec","retrievedAt":"2026-08-02","sha256":"eda3020070376c5cc61d15044b5bfbbd0cdf73267d1d82063bb0659df36add64","url":"https://agents.md/"}]}